id, first_name, last_name, married_name, nickname, dob, state, phone#
1, esa-matti, tastula, n/a, sweenu, 1/1/1983, CA, +1-727-480-1999
2, tommy, sullivan, n/a, t-bone, 7/2/1980, CA, +1-216-835-8628
3, johnny, thomas, n/a, bones, 5/13/1988, NJ, +1-856-357-5911
4, ryan, thomas, n/a, ryguy, 5/4/1990, PA, +1-856-357-5893
5, monica, thomas, hummel, mondawg, 11/18/1994, NJ, +1-856-449-3891
6, patrick, metsch, n/a, peepcake, 6/23/1988, OH, +1-440-724-7507
7, lynnsie, collins, n/a, lynnscaribou, 6/25/1997, NJ, +1-609-254-5496
8, michael, sullivan, n/a, doodlebug, 10/11/1981, OH, +1-440-666-2576